{
  "$schema": "https://json-schema.org/draft/2020-12/schema",
  "$id": "https://raw.githubusercontent.com/evk-soft/devkit/refs/tags/ai-tooling-v0.1.0/packages/ai-tooling/schemas/pack.schema.json",
  "title": "EVK AI content pack, version 1",
  "type": "object",
  "additionalProperties": false,
  "required": ["version", "name", "packVersion", "rules", "skills"],
  "properties": {
    "version": { "const": 1 },
    "name": { "$ref": "#/$defs/packageName" },
    "packVersion": { "$ref": "#/$defs/semanticVersion" },
    "description": { "type": "string", "maxLength": 1000, "default": "" },
    "rules": {
      "type": "array",
      "uniqueItems": true,
      "maxItems": 10000,
      "items": { "$ref": "#/$defs/declaration" }
    },
    "skills": {
      "type": "array",
      "uniqueItems": true,
      "maxItems": 10000,
      "items": { "$ref": "#/$defs/declaration" }
    }
  },
  "$defs": {
    "packageName": {
      "type": "string",
      "pattern": "^@[a-z0-9][a-z0-9._-]*/[a-z0-9][a-z0-9._-]*$",
      "maxLength": 214
    },
    "semanticVersion": {
      "type": "string",
      "pattern": "^(0|[1-9][0-9]*)\\.(0|[1-9][0-9]*)\\.(0|[1-9][0-9]*)$",
      "maxLength": 64
    },
    "resourceId": {
      "type": "string",
      "pattern": "^[a-z0-9]+(?:-[a-z0-9]+)*(?:/[a-z0-9]+(?:-[a-z0-9]+)*)*$",
      "maxLength": 256
    },
    "relativeDirectory": {
      "type": "string",
      "pattern": "^(?!\\.\\.?(?:/|$))[A-Za-z0-9._-]+(?:/(?!\\.\\.?(?:/|$))[A-Za-z0-9._-]+)*$",
      "maxLength": 1024
    },
    "declaration": {
      "type": "object",
      "additionalProperties": false,
      "required": ["id", "path"],
      "properties": {
        "id": { "$ref": "#/$defs/resourceId" },
        "path": { "$ref": "#/$defs/relativeDirectory" }
      }
    }
  }
}
